{
  "domain": "devops",
  "description": "On-call / SRE assistant over UTC-native observability systems: log search, deploy history, and incident records. All backend timestamps are UTC; users speak in local wall time.",
  "tools": [
    {
      "name": "query_logs",
      "description": "Search service logs. Returns log rows whose timestamp falls in [start_utc, end_utc). Both bounds are required and must be UTC ISO 8601 strings (e.g. 2026-07-01T00:00:00Z); start is inclusive, end is exclusive.",
      "params": [
        {
          "name": "query",
          "type": "string",
          "description": "Free-text filter on service name / message (optional; empty returns all rows in range)",
          "required": false
        },
        {
          "name": "level",
          "type": "string",
          "description": "Log level filter: error, warn, or info (optional)",
          "required": false
        },
        {
          "name": "start_utc",
          "type": "string",
          "description": "Range start, UTC ISO 8601 (e.g. 2026-07-01T00:00:00Z), inclusive",
          "required": true
        },
        {
          "name": "end_utc",
          "type": "string",
          "description": "Range end, UTC ISO 8601, exclusive",
          "required": true
        }
      ],
      "mock": {
        "kind": "filter-rows",
        "rowsKey": "logs",
        "timestampField": "timestamp_utc",
        "startParam": "start_utc",
        "endParam": "end_utc"
      }
    },
    {
      "name": "list_deploys",
      "description": "List production deploys. Returns deploys whose timestamp falls in [start_utc, end_utc). Both bounds are required and must be UTC ISO 8601 strings (e.g. 2026-07-01T00:00:00Z); start is inclusive, end is exclusive.",
      "params": [
        {
          "name": "start_utc",
          "type": "string",
          "description": "Range start, UTC ISO 8601 (e.g. 2026-07-01T00:00:00Z), inclusive",
          "required": true
        },
        {
          "name": "end_utc",
          "type": "string",
          "description": "Range end, UTC ISO 8601, exclusive",
          "required": true
        }
      ],
      "mock": {
        "kind": "filter-rows",
        "rowsKey": "deploys",
        "timestampField": "timestamp_utc",
        "startParam": "start_utc",
        "endParam": "end_utc"
      }
    },
    {
      "name": "get_latest_incident",
      "description": "Return the most recent incident on record, with started_utc and resolved_utc timestamps (UTC ISO 8601).",
      "params": [],
      "mock": {
        "kind": "static"
      }
    },
    {
      "name": "get_last_deploy",
      "description": "Return the most recent production deploy on record (UTC ISO 8601 timestamp).",
      "params": [],
      "mock": {
        "kind": "static"
      }
    }
  ],
  "scenarios": [
    {
      "id": "dev-01",
      "title": "deploy-window-spanning-local-midnight",
      "context": {
        "now": "2026-07-16T09:30:00-07:00",
        "timeZone": "America/Los_Angeles",
        "locale": "en-US"
      },
      "user": "We had a deploy window last night between 11pm and 1am. Any errors during the window?",
      "mocks": {
        "query_logs": {
          "rows": [
            {
              "service": "checkout-api",
              "level": "error",
              "message": "connection pool exhausted",
              "timestamp_utc": "2026-07-16T06:12:00Z"
            },
            {
              "service": "checkout-api",
              "level": "error",
              "message": "migration lock timeout",
              "timestamp_utc": "2026-07-16T07:41:00Z"
            },
            {
              "service": "checkout-api",
              "level": "error",
              "message": "stale config reload",
              "timestamp_utc": "2026-07-15T23:30:00Z"
            },
            {
              "service": "inventory-svc",
              "level": "error",
              "message": "cache miss storm",
              "timestamp_utc": "2026-07-16T08:25:00Z"
            }
          ]
        },
        "list_deploys": {
          "rows": [
            {
              "service": "checkout-api",
              "version": "v3.8.0",
              "status": "success",
              "timestamp_utc": "2026-07-16T06:05:00Z"
            }
          ]
        },
        "get_last_deploy": {
          "response": {
            "service": "checkout-api",
            "version": "v3.8.0",
            "status": "success",
            "timestamp_utc": "2026-07-16T06:05:00Z",
            "deployed_by": "mira"
          }
        }
      },
      "expect": {
        "toolCalls": [
          {
            "tool": "query_logs",
            "graded": [
              "start_utc",
              "end_utc"
            ],
            "argKinds": {
              "start_utc": "instant-start",
              "end_utc": "instant-end"
            },
            "admissible": [
              {
                "start_utc": "2026-07-16T06:00:00Z",
                "end_utc": "2026-07-16T08:00:00Z"
              }
            ],
            "verifyPhrase": {
              "phrase": "last night between 11pm and 1am"
            }
          }
        ],
        "response": {
          "checks": [
            {
              "kind": "count",
              "expected": 2,
              "unit": "errors?|failures?",
              "note": "06:12Z (11:12pm PDT) and 07:41Z (12:41am PDT) are inside the window; the 23:30Z row (4:30pm PDT Wed) and 08:25Z row (1:25am PDT) are outside"
            }
          ]
        }
      },
      "directions": [
        "nl2time",
        "time2nl"
      ],
      "rationale": "Now = THURSDAY Jul 16 2026, 9:30am PDT (UTC-7). 'Last night between 11pm and 1am' = Wed Jul 15 23:00 PT .. Thu Jul 16 01:00 PT = [2026-07-16T06:00Z, 2026-07-16T08:00Z) — the window spans local midnight but sits entirely inside UTC day Jul 16. In range: 06:12Z = Wed 11:12pm PDT and 07:41Z = Thu 12:41am PDT (count 2). Traps: reading '11pm-1am' as UTC gives [2026-07-15T23:00Z, 2026-07-16T01:00Z), which selects only the 23:30Z decoy (4:30pm PDT — hours before the window); the 08:25Z row (1:25am PDT) is just after the window. nl2time disagrees on the end bound (see disagreementNote), which under its reading would also drop the 07:41Z row."
    },
    {
      "id": "dev-02",
      "title": "deploys-yesterday-berlin",
      "context": {
        "now": "2026-07-21T10:05:00+02:00",
        "timeZone": "Europe/Berlin",
        "locale": "en-DE"
      },
      "user": "How many deploys went out yesterday?",
      "mocks": {
        "list_deploys": {
          "rows": [
            {
              "service": "payments-api",
              "version": "v2.4.1",
              "status": "success",
              "timestamp_utc": "2026-07-19T22:45:00Z"
            },
            {
              "service": "payments-api",
              "version": "v2.4.2",
              "status": "success",
              "timestamp_utc": "2026-07-19T23:20:00Z"
            },
            {
              "service": "web-storefront",
              "version": "v8.1.0",
              "status": "success",
              "timestamp_utc": "2026-07-20T13:05:00Z"
            },
            {
              "service": "search-svc",
              "version": "v1.12.0",
              "status": "success",
              "timestamp_utc": "2026-07-20T22:30:00Z"
            },
            {
              "service": "web-storefront",
              "version": "v8.0.9",
              "status": "success",
              "timestamp_utc": "2026-07-18T09:00:00Z"
            }
          ]
        },
        "get_last_deploy": {
          "response": {
            "service": "search-svc",
            "version": "v1.12.0",
            "status": "success",
            "timestamp_utc": "2026-07-20T22:30:00Z",
            "deployed_by": "jonas"
          }
        }
      },
      "expect": {
        "toolCalls": [
          {
            "tool": "list_deploys",
            "graded": [
              "start_utc",
              "end_utc"
            ],
            "argKinds": {
              "start_utc": "instant-start",
              "end_utc": "instant-end"
            },
            "admissible": [
              {
                "start_utc": "2026-07-19T22:00:00Z",
                "end_utc": "2026-07-20T22:00:00Z"
              }
            ],
            "verifyPhrase": {
              "phrase": "yesterday"
            }
          }
        ],
        "response": {
          "checks": [
            {
              "kind": "count",
              "expected": 3,
              "unit": "deploys?|deployments?|releases?",
              "note": "Two just-after-midnight CEST deploys (22:45Z, 23:20Z on Jul 19 UTC) plus the 13:05Z afternoon deploy; the 22:30Z row is already Tuesday in Berlin"
            }
          ]
        }
      },
      "directions": [
        "nl2time",
        "time2nl"
      ],
      "rationale": "Now = TUESDAY Jul 21 2026, 10:05 CEST (UTC+2, Berlin summer time). Yesterday = civil Monday Jul 20 in Berlin: [Jul 20 00:00 CEST, Jul 21 00:00 CEST) = [2026-07-19T22:00Z, 2026-07-20T22:00Z). In range: 2026-07-19T22:45Z = Mon 00:45 CEST, 2026-07-19T23:20Z = Mon 01:20 CEST, 2026-07-20T13:05Z = Mon 15:05 CEST → count 3. Traps: naive UTC-day bounds [Jul 20 00:00Z, Jul 21 00:00Z) drop both after-midnight-CEST deploys (their UTC day is Jul 19) and include the 22:30Z decoy (Tue 00:30 CEST) → count 2, so the counts differ. The Sat Jul 18 row is outside all readings. Bridge cross-check: nl2time resolves 'yesterday' in this context to exactly [2026-07-19T22:00Z, 2026-07-20T22:00Z)."
    },
    {
      "id": "dev-03",
      "title": "errors-past-6-hours",
      "context": {
        "now": "2026-07-08T14:20:00-04:00",
        "timeZone": "America/New_York",
        "locale": "en-US"
      },
      "user": "How many errors have we logged in the past 6 hours?",
      "mocks": {
        "query_logs": {